event_date,matter_label,event_type,asset_or_amount,amount_usd,statutory_hook,allegation_status,source_url,source_note
2022-03-02,Task Force KleptoCapture launch,program launch,task force,,sanctions export controls anticorruption asset forfeiture,program announced,https://www.justice.gov/archives/opa/pr/attorney-general-merrick-b-garland-announces-launch-task-force-kleptocapture,DOJ announced a task force with sanctions export-control anticorruption asset-forfeiture AML tax national-security and foreign-evidence expertise.
2022-04-04,Tango yacht seizure,seizure,yacht Tango,90000000,sanctions enforcement and asset forfeiture,seized at US request,https://www.justice.gov/usao-dc/pr/90-million-yacht-sanctioned-russian-oligarch-viktor-vekselberg-seized-spain-request,Release describes a seizure coordinated through Task Force KleptoCapture.
2022-06-06,Abramovich aircraft seizure warrants,seizure warrants,two aircraft,400000000,export-control enforcement,seizure warrants obtained,https://www.justice.gov/usao-sdny/pr/united-states-obtains-warrant-seizure-two-airplanes-russian-oligarch-roman-abramovich,Release states seizure warrants were obtained and that forfeitability burden is on the government.
2023-03-09,REPO Task Force one-year statement,freeze and seizure context,blocked or frozen assets,58000000000,sanctions and asset tracing,blocked or frozen not forfeited,https://home.treasury.gov/news/press-releases/jy1329,Treasury joint statement reports more than 58 billion dollars blocked or frozen by REPO members and distinguishes freeze or seizure from final forfeiture.
2023-10-23,Amadea civil forfeiture complaint,civil forfeiture complaint,superyacht Amadea,300000000,IEEPA and money laundering,complaint allegations not proven,https://www.justice.gov/archives/opa/pr/justice-department-files-civil-forfeiture-complaint-against-300-million-superyacht,DOJ states the complaint is an allegation and allegations are not proven until judgment for the United States.
2024-06-13,1MDB repatriation,repatriation,returned funds,1400000000,civil forfeiture and money laundering,repatriated or assisted return,https://www.justice.gov/archives/opa/pr/justice-department-repatriates-14b-misappropriated-1mdb-funds-malaysia,DOJ announced approximately 1.4 billion dollars repatriated or assisted in returning to Malaysia.
2026-05-27,1MDB New York apartment forfeiture order,forfeiture order,apartment and rental proceeds,6000000,civil forfeiture and money laundering,order obtained,https://www.justice.gov/opa/pr/justice-department-recovers-over-6m-additional-funds-linked-1mdb-scheme,DOJ announced an order forfeiting a luxury New York apartment and certain rental income.
